{
  "name"        : "Rodas3d",
  "description" : "Rodas3d: SciML OrdinaryDiffEq Rosenbrock tableau at 211142263781255a9aa2f910f6760b9f18ec29c8.",
  "kind"        : "rosenbrock",
  "order"       : 3,
  "gamma"       : 0.57281606,
  "A"           : [
    [0, 0, 0, 0],
    [2.1736562342774159, 0, 0, 0],
    [1.745761108723104, 0, 0, 0],
    [1.745761108723104, 0, 1, 0]
  ],
  "C"           : [
    [0, 0, 0, 0],
    [-13.387001858207178, 0, 0, 0],
    [0.30442314006596932, 0.30745278826153299, 0, 0],
    [0.57287646414081528, 0.34771098605699358, -2.7425340696473901, 0]
  ],
  "c"           : [0, 1.2451051999132263, 1, 1],
  "d"           : [0.57281606, -3.819703409768521, 0, 0],
  "b"           : [1.745761108723104, 0, 1, 1],
  "btilde"      : [0, 0, 0, 1],
  "H"           : []
}
