{
  "name"        : "Rodas3P",
  "description" : "Rodas3P: SciML OrdinaryDiffEq Rosenbrock tableau at 211142263781255a9aa2f910f6760b9f18ec29c8.",
  "kind"        : "rosenbrock",
  "order"       : 3,
  "gamma"       : "1.0 / 3.0",
  "A"           : [
    [0, 0, 0, 0, 0],
    ["4.0 / 3.0", 0, 0, 0, 0],
    [0, 0, 0, 0, 0],
    [2.90625, 3.375, 0.40625, 0, 0],
    [2.90625, 3.375, 0.40625, 0, 0]
  ],
  "C"           : [
    [0, 0, 0, 0, 0],
    [-4, 0, 0, 0, 0],
    [8.25, 6.75, 0, 0, 0],
    [1.21875, -5.0625, -1.96875, 0, 0],
    [4.03125, -15.1875, -4.03125, 6, 0]
  ],
  "c"           : [0, "4.0 / 9.0", 0, 1, 1],
  "d"           : ["1.0 / 3.0", "-1.0 / 9.0", 1, 0, 0],
  "b"           : [2.90625, 3.375, 0.40625, 0, 1],
  "btilde"      : [0, 0, 0, -1, 1],
  "H"           : [
    [1.78125, 6.75, 0.15625, -6, -1],
    [4.21875, -15.1875, -3.09375, 9, 0],
    [4.21875, -2.025, -1.63125, -1.7, -0.1]
  ]
}
